[
  {
    "id": "fac00000-0000-4000-8000-000000000001",
    "entity_kind": "poi",
    "entity_id": "f0000000-0000-4000-8000-000000000001",
    "attribute": "admission_price",
    "value": { "amount": 8, "currency": "EUR", "note": "redeemable against a book purchase" },
    "source_url": "https://www.livrarialello.pt/en/visit",
    "source_kind": "official_site",
    "observed_at": "2026-05-20T10:00:00Z",
    "confidence": 0.95,
    "corroboration_count": 3,
    "status": "active"
  },
  {
    "id": "fac00000-0000-4000-8000-000000000002",
    "entity_kind": "poi",
    "entity_id": "f0000000-0000-4000-8000-000000000001",
    "attribute": "opening_year",
    "value": 1906,
    "source_url": "https://www.wikidata.org/wiki/Q1160538",
    "source_kind": "wikidata",
    "observed_at": "2026-05-20T10:01:00Z",
    "confidence": 0.99,
    "corroboration_count": 4,
    "status": "active"
  },
  {
    "id": "fac00000-0000-4000-8000-000000000003",
    "entity_kind": "poi",
    "entity_id": "f0000000-0000-4000-8000-000000000002",
    "attribute": "height_m",
    "value": 75.6,
    "source_url": "https://www.wikidata.org/wiki/Q1148991",
    "source_kind": "wikidata",
    "observed_at": "2026-05-20T10:02:00Z",
    "confidence": 0.97,
    "corroboration_count": 2,
    "status": "active"
  },
  {
    "id": "fac00000-0000-4000-8000-000000000004",
    "entity_kind": "poi",
    "entity_id": "f0000000-0000-4000-8000-000000000002",
    "attribute": "admission_price",
    "value": { "amount": 8, "currency": "EUR" },
    "source_url": "https://www.torredosclerigos.pt/en/tickets",
    "source_kind": "official_site",
    "observed_at": "2026-05-20T10:03:00Z",
    "confidence": 0.9,
    "corroboration_count": 1,
    "status": "active"
  },
  {
    "id": "fac00000-0000-4000-8000-000000000005",
    "entity_kind": "poi",
    "entity_id": "f0000000-0000-4000-8000-000000000004",
    "attribute": "admission_price",
    "value": { "amount": 3, "currency": "EUR" },
    "source_url": "https://web.archive.org/web/2024/porto-cathedral",
    "source_kind": "web_review",
    "observed_at": "2024-09-01T00:00:00Z",
    "confidence": 0.4,
    "corroboration_count": 0,
    "status": "superseded"
  },
  {
    "id": "fac00000-0000-4000-8000-000000000006",
    "entity_kind": "poi",
    "entity_id": "f0000000-0000-4000-8000-000000000004",
    "attribute": "admission_price",
    "value": { "amount": 3, "currency": "EUR", "cloister_included": true },
    "source_url": "https://www.diocese-porto.pt/se",
    "source_kind": "official_site",
    "observed_at": "2026-05-20T10:05:00Z",
    "confidence": 0.92,
    "corroboration_count": 2,
    "status": "active"
  },
  {
    "id": "fac00000-0000-4000-8000-000000000007",
    "entity_kind": "poi",
    "entity_id": "f0000000-0000-4000-8000-000000000006",
    "attribute": "typical_visit_minutes",
    "value": 120,
    "source_url": null,
    "source_kind": "llm_research",
    "observed_at": "2026-05-20T10:06:00Z",
    "confidence": 0.55,
    "corroboration_count": 1,
    "status": "active"
  },
  {
    "id": "fac00000-0000-4000-8000-000000000008",
    "entity_kind": "poi",
    "entity_id": "f0000000-0000-4000-8000-000000000008",
    "attribute": "wifi_available",
    "value": true,
    "source_url": "https://reviews.example.com/majestic",
    "source_kind": "web_review",
    "observed_at": "2026-04-11T00:00:00Z",
    "confidence": 0.35,
    "corroboration_count": 0,
    "status": "disputed"
  },
  {
    "id": "fac00000-0000-4000-8000-000000000009",
    "entity_kind": "city",
    "entity_id": "c0a70000-0000-4000-8000-000000000001",
    "attribute": "tap_water_potable",
    "value": true,
    "source_url": "https://www.who.int/porto-water-quality",
    "source_kind": "advisory",
    "observed_at": "2026-03-01T00:00:00Z",
    "confidence": 0.98,
    "corroboration_count": 5,
    "status": "active"
  },
  {
    "id": "fac00000-0000-4000-8000-00000000000a",
    "entity_kind": "city",
    "entity_id": "c0a70000-0000-4000-8000-000000000001",
    "attribute": "unesco_world_heritage",
    "value": { "inscribed": 1996, "site": "Historic Centre of Oporto" },
    "source_url": "https://whc.unesco.org/en/list/755",
    "source_kind": "open_data",
    "observed_at": "2026-03-01T00:00:00Z",
    "confidence": 1,
    "corroboration_count": 6,
    "status": "active"
  },
  {
    "id": "fac00000-0000-4000-8000-00000000000b",
    "entity_kind": "poi",
    "entity_id": "f0000000-0000-4000-8000-00000000000a",
    "attribute": "reopened_after_renovation",
    "value": { "date": "2022-09-15" },
    "source_url": "https://en.wikipedia.org/wiki/Bolh%C3%A3o_Market",
    "source_kind": "user_correction",
    "observed_at": "2026-06-03T18:22:00Z",
    "confidence": 0.7,
    "corroboration_count": 1,
    "status": "active"
  }
]
